{
  "artifact": "comparison_results",
  "artifact_schema_version": "1.0",
  "claims": {
    "note": "QAOA results are local noiseless simulation. They inherit M2's assessment and conditions; a verified sample is a placement in the requested-resource model, not a drain approval.",
    "operational_assessment": "REVIEW_REQUIRED",
    "quantum_optimality_proven": false
  },
  "classical": {
    "candidates": 3,
    "exact": {
      "assignments": [
        {
          "node": "worker-01",
          "pod": "analytics/ingest-1a2b3c-aaaaa"
        }
      ],
      "objective": {
        "assigned": 1,
        "balance_leximin": [
          "1/20"
        ],
        "min_free_fraction": "1/20"
      },
      "optimality_proven": true,
      "placed": 1,
      "verified": true
    },
    "greedy": {
      "assignments": [
        {
          "node": "worker-01",
          "pod": "analytics/ingest-1a2b3c-aaaaa"
        }
      ],
      "objective": {
        "assigned": 1,
        "balance_leximin": [
          "1/20"
        ],
        "min_free_fraction": "1/20"
      },
      "placed": 1,
      "verified": true
    },
    "m2_assessment": "REVIEW_REQUIRED",
    "timing_seconds": {
      "exact_seconds": {
        "max": 2.60830856859684e-05,
        "median": 2.1209008991718292e-05,
        "min": 1.987488940358162e-05,
        "repeats": 5
      },
      "greedy_seconds": {
        "max": 2.445909194648266e-05,
        "median": 1.7458107322454453e-05,
        "min": 1.650000922381878e-05,
        "repeats": 5
      }
    }
  },
  "fixture": "fixture_b_insufficient",
  "generator": {
    "milestone": "M3",
    "name": "qplace",
    "version": "0.1.0"
  },
  "observational": true,
  "quantum": [
    {
      "best_verified_sample": {
        "assignment": [
          {
            "node": "worker-01",
            "pod": "analytics/ingest-1a2b3c-aaaaa"
          }
        ],
        "bitstring": "1",
        "count": 1024,
        "m2_objective": {
          "assigned": 1,
          "balance_leximin": [
            "1/20"
          ],
          "min_free_fraction": "1/20"
        },
        "placed": 1,
        "qubo_energy": -1,
        "raw_feasible": true,
        "verification_errors": [],
        "verified": true
      },
      "better_than_uniform": true,
      "circuit_depth": 4,
      "estimator_evaluations": 178,
      "exact_count_sample_rate_mean": 1.0,
      "exact_probability_of_optimal_count": 0.999999999259237,
      "feasible_sample_rate_mean": 1.0,
      "m2_objective_equals_exact": true,
      "optimality_gap_pods": 0,
      "per_seed": [
        {
          "best_placed": 1,
          "exact_count_sample_rate": 1.0,
          "feasible_sample_rate": 1.0,
          "seed": 11,
          "status": "FEASIBLE_SAMPLE_MATCHES_EXACT_COUNT"
        },
        {
          "best_placed": 1,
          "exact_count_sample_rate": 1.0,
          "feasible_sample_rate": 1.0,
          "seed": 22,
          "status": "FEASIBLE_SAMPLE_MATCHES_EXACT_COUNT"
        },
        {
          "best_placed": 1,
          "exact_count_sample_rate": 1.0,
          "feasible_sample_rate": 1.0,
          "seed": 33,
          "status": "FEASIBLE_SAMPLE_MATCHES_EXACT_COUNT"
        },
        {
          "best_placed": 1,
          "exact_count_sample_rate": 1.0,
          "feasible_sample_rate": 1.0,
          "seed": 44,
          "status": "FEASIBLE_SAMPLE_MATCHES_EXACT_COUNT"
        },
        {
          "best_placed": 1,
          "exact_count_sample_rate": 1.0,
          "feasible_sample_rate": 1.0,
          "seed": 55,
          "status": "FEASIBLE_SAMPLE_MATCHES_EXACT_COUNT"
        }
      ],
      "qubits": 1,
      "ratio_to_uniform": 1.999999998518474,
      "reps": 1,
      "sampler_jobs": 5,
      "sampling_seconds_median": 0.0018223330844193697,
      "seeds_reaching_exact_count": 5,
      "solver_result": {
        "assignments": [
          {
            "node": "worker-01",
            "pod": "analytics/ingest-1a2b3c-aaaaa"
          }
        ],
        "optimality_proven": false,
        "solver": "qaoa",
        "unplaced": [
          "analytics/batch-worker-8c9d0e-aaaaa",
          "analytics/reporter-9e8d7c-aaaaa"
        ]
      },
      "solver_result_seed": 11,
      "training_seconds": 0.07474995800293982,
      "two_qubit_gates": 0,
      "uniform_probability_of_optimal_count": 0.5
    },
    {
      "best_verified_sample": {
        "assignment": [
          {
            "node": "worker-01",
            "pod": "analytics/ingest-1a2b3c-aaaaa"
          }
        ],
        "bitstring": "1",
        "count": 1024,
        "m2_objective": {
          "assigned": 1,
          "balance_leximin": [
            "1/20"
          ],
          "min_free_fraction": "1/20"
        },
        "placed": 1,
        "qubo_energy": -1,
        "raw_feasible": true,
        "verification_errors": [],
        "verified": true
      },
      "better_than_uniform": true,
      "circuit_depth": 6,
      "estimator_evaluations": 186,
      "exact_count_sample_rate_mean": 1.0,
      "exact_probability_of_optimal_count": 0.9999999970214919,
      "feasible_sample_rate_mean": 1.0,
      "m2_objective_equals_exact": true,
      "optimality_gap_pods": 0,
      "per_seed": [
        {
          "best_placed": 1,
          "exact_count_sample_rate": 1.0,
          "feasible_sample_rate": 1.0,
          "seed": 11,
          "status": "FEASIBLE_SAMPLE_MATCHES_EXACT_COUNT"
        },
        {
          "best_placed": 1,
          "exact_count_sample_rate": 1.0,
          "feasible_sample_rate": 1.0,
          "seed": 22,
          "status": "FEASIBLE_SAMPLE_MATCHES_EXACT_COUNT"
        },
        {
          "best_placed": 1,
          "exact_count_sample_rate": 1.0,
          "feasible_sample_rate": 1.0,
          "seed": 33,
          "status": "FEASIBLE_SAMPLE_MATCHES_EXACT_COUNT"
        },
        {
          "best_placed": 1,
          "exact_count_sample_rate": 1.0,
          "feasible_sample_rate": 1.0,
          "seed": 44,
          "status": "FEASIBLE_SAMPLE_MATCHES_EXACT_COUNT"
        },
        {
          "best_placed": 1,
          "exact_count_sample_rate": 1.0,
          "feasible_sample_rate": 1.0,
          "seed": 55,
          "status": "FEASIBLE_SAMPLE_MATCHES_EXACT_COUNT"
        }
      ],
      "qubits": 1,
      "ratio_to_uniform": 1.9999999940429838,
      "reps": 2,
      "sampler_jobs": 5,
      "sampling_seconds_median": 0.0018722908571362495,
      "seeds_reaching_exact_count": 5,
      "solver_result": {
        "assignments": [
          {
            "node": "worker-01",
            "pod": "analytics/ingest-1a2b3c-aaaaa"
          }
        ],
        "optimality_proven": false,
        "solver": "qaoa",
        "unplaced": [
          "analytics/batch-worker-8c9d0e-aaaaa",
          "analytics/reporter-9e8d7c-aaaaa"
        ]
      },
      "solver_result_seed": 11,
      "training_seconds": 0.08817737479694188,
      "two_qubit_gates": 0,
      "uniform_probability_of_optimal_count": 0.5
    }
  ],
  "quantum_skipped": null,
  "source": {
    "snapshot_id": "fixture-b-insufficient",
    "source_sha256": "6959fbc701e487288f5caeab3e42963506b4c1b773811f3d371a0316846ea04a"
  },
  "target_node": "worker-02",
  "uniform_random_baseline": {
    "exact_count_rate": 0.5,
    "feasible_rate": 1.0,
    "nonempty_feasible_rate": 0.5,
    "probability_seed_hits_exact_count_in_shots": 1.0,
    "shots": 1024,
    "states": 2
  }
}
