{
  "artifact": "comparison_results",
  "artifact_schema_version": "1.0",
  "claims": {
    "note": "QAOA results are local noiseless simulation. They inherit M2's assessment and conditions; a verified sample is a placement in the requested-resource model, not a drain approval.",
    "operational_assessment": "MODELED_BLOCKED",
    "quantum_optimality_proven": false
  },
  "classical": {
    "candidates": 2,
    "exact": {
      "assignments": [
        {
          "node": "node-1",
          "pod": "apps/tiny-6f7a8b-aaaaa"
        }
      ],
      "objective": {
        "assigned": 1,
        "balance_leximin": [
          "0/1",
          "1/1"
        ],
        "min_free_fraction": "0/1"
      },
      "optimality_proven": true,
      "placed": 1,
      "verified": true
    },
    "greedy": {
      "assignments": [
        {
          "node": "node-1",
          "pod": "apps/tiny-6f7a8b-aaaaa"
        }
      ],
      "objective": {
        "assigned": 1,
        "balance_leximin": [
          "0/1",
          "1/1"
        ],
        "min_free_fraction": "0/1"
      },
      "placed": 1,
      "verified": true
    },
    "m2_assessment": "MODELED_BLOCKED",
    "timing_seconds": {
      "exact_seconds": {
        "max": 5.250005051493645e-05,
        "median": 4.6209199354052544e-05,
        "min": 4.52918466180563e-05,
        "repeats": 5
      },
      "greedy_seconds": {
        "max": 2.2042077034711838e-05,
        "median": 1.5707919374108315e-05,
        "min": 1.5083001926541328e-05,
        "repeats": 5
      }
    }
  },
  "fixture": "scenario_f_pod_slots",
  "generator": {
    "milestone": "M3",
    "name": "qplace",
    "version": "0.1.0"
  },
  "observational": true,
  "quantum": [
    {
      "best_verified_sample": {
        "assignment": [
          {
            "node": "node-1",
            "pod": "apps/tiny-6f7a8b-aaaaa"
          }
        ],
        "bitstring": "01",
        "count": 532,
        "m2_objective": {
          "assigned": 1,
          "balance_leximin": [
            "0/1",
            "1/1"
          ],
          "min_free_fraction": "0/1"
        },
        "placed": 1,
        "qubo_energy": -1,
        "raw_feasible": true,
        "verification_errors": [],
        "verified": true
      },
      "better_than_uniform": true,
      "circuit_depth": 4,
      "estimator_evaluations": 180,
      "exact_count_sample_rate_mean": 1.0,
      "exact_probability_of_optimal_count": 0.9999998936502164,
      "feasible_sample_rate_mean": 1.0,
      "m2_objective_equals_exact": true,
      "optimality_gap_pods": 0,
      "per_seed": [
        {
          "best_placed": 1,
          "exact_count_sample_rate": 1.0,
          "feasible_sample_rate": 1.0,
          "seed": 11,
          "status": "FEASIBLE_SAMPLE_MATCHES_EXACT_COUNT"
        },
        {
          "best_placed": 1,
          "exact_count_sample_rate": 1.0,
          "feasible_sample_rate": 1.0,
          "seed": 22,
          "status": "FEASIBLE_SAMPLE_MATCHES_EXACT_COUNT"
        },
        {
          "best_placed": 1,
          "exact_count_sample_rate": 1.0,
          "feasible_sample_rate": 1.0,
          "seed": 33,
          "status": "FEASIBLE_SAMPLE_MATCHES_EXACT_COUNT"
        },
        {
          "best_placed": 1,
          "exact_count_sample_rate": 1.0,
          "feasible_sample_rate": 1.0,
          "seed": 44,
          "status": "FEASIBLE_SAMPLE_MATCHES_EXACT_COUNT"
        },
        {
          "best_placed": 1,
          "exact_count_sample_rate": 1.0,
          "feasible_sample_rate": 1.0,
          "seed": 55,
          "status": "FEASIBLE_SAMPLE_MATCHES_EXACT_COUNT"
        }
      ],
      "qubits": 2,
      "ratio_to_uniform": 1.9999997873004327,
      "reps": 1,
      "sampler_jobs": 5,
      "sampling_seconds_median": 0.002047165995463729,
      "seeds_reaching_exact_count": 5,
      "solver_result": {
        "assignments": [
          {
            "node": "node-1",
            "pod": "apps/tiny-6f7a8b-aaaaa"
          }
        ],
        "optimality_proven": false,
        "solver": "qaoa",
        "unplaced": [
          "apps/tiny-6f7a8b-bbbbb"
        ]
      },
      "solver_result_seed": 11,
      "training_seconds": 0.0819860000628978,
      "two_qubit_gates": 1,
      "uniform_probability_of_optimal_count": 0.5
    },
    {
      "best_verified_sample": {
        "assignment": [
          {
            "node": "node-1",
            "pod": "apps/tiny-6f7a8b-aaaaa"
          }
        ],
        "bitstring": "01",
        "count": 532,
        "m2_objective": {
          "assigned": 1,
          "balance_leximin": [
            "0/1",
            "1/1"
          ],
          "min_free_fraction": "0/1"
        },
        "placed": 1,
        "qubo_energy": -1,
        "raw_feasible": true,
        "verification_errors": [],
        "verified": true
      },
      "better_than_uniform": true,
      "circuit_depth": 6,
      "estimator_evaluations": 187,
      "exact_count_sample_rate_mean": 1.0,
      "exact_probability_of_optimal_count": 0.9999999952474729,
      "feasible_sample_rate_mean": 1.0,
      "m2_objective_equals_exact": true,
      "optimality_gap_pods": 0,
      "per_seed": [
        {
          "best_placed": 1,
          "exact_count_sample_rate": 1.0,
          "feasible_sample_rate": 1.0,
          "seed": 11,
          "status": "FEASIBLE_SAMPLE_MATCHES_EXACT_COUNT"
        },
        {
          "best_placed": 1,
          "exact_count_sample_rate": 1.0,
          "feasible_sample_rate": 1.0,
          "seed": 22,
          "status": "FEASIBLE_SAMPLE_MATCHES_EXACT_COUNT"
        },
        {
          "best_placed": 1,
          "exact_count_sample_rate": 1.0,
          "feasible_sample_rate": 1.0,
          "seed": 33,
          "status": "FEASIBLE_SAMPLE_MATCHES_EXACT_COUNT"
        },
        {
          "best_placed": 1,
          "exact_count_sample_rate": 1.0,
          "feasible_sample_rate": 1.0,
          "seed": 44,
          "status": "FEASIBLE_SAMPLE_MATCHES_EXACT_COUNT"
        },
        {
          "best_placed": 1,
          "exact_count_sample_rate": 1.0,
          "feasible_sample_rate": 1.0,
          "seed": 55,
          "status": "FEASIBLE_SAMPLE_MATCHES_EXACT_COUNT"
        }
      ],
      "qubits": 2,
      "ratio_to_uniform": 1.9999999904949457,
      "reps": 2,
      "sampler_jobs": 5,
      "sampling_seconds_median": 0.0021759159862995148,
      "seeds_reaching_exact_count": 5,
      "solver_result": {
        "assignments": [
          {
            "node": "node-1",
            "pod": "apps/tiny-6f7a8b-aaaaa"
          }
        ],
        "optimality_proven": false,
        "solver": "qaoa",
        "unplaced": [
          "apps/tiny-6f7a8b-bbbbb"
        ]
      },
      "solver_result_seed": 11,
      "training_seconds": 0.09935400006361306,
      "two_qubit_gates": 2,
      "uniform_probability_of_optimal_count": 0.5
    }
  ],
  "quantum_skipped": null,
  "source": {
    "snapshot_id": "m2-scenario-f-pod-slots",
    "source_sha256": "b285404b3f20ebc7b5ced01fa9b2ee582806df1816d08939e2bdc3221e621587"
  },
  "target_node": "source",
  "uniform_random_baseline": {
    "exact_count_rate": 0.5,
    "feasible_rate": 0.75,
    "nonempty_feasible_rate": 0.5,
    "probability_seed_hits_exact_count_in_shots": 1.0,
    "shots": 1024,
    "states": 4
  }
}
